{
  "id": "apartment-b",
  "title": "One-bedroom apartment, 55 m²",
  "areaM2": 55,
  "floor": 1,
  "location": {
    "lat": 45.07,
    "lon": 7.69
  },
  "northAngleDeg": 180,
  "ceilingHeight": 2.7,
  "rooms": [
    {
      "id": "living",
      "name": "Living room & kitchen",
      "polygon": [
        [
          0,
          0
        ],
        [
          4.8,
          0
        ],
        [
          4.8,
          4.2
        ],
        [
          0,
          4.2
        ]
      ],
      "floorMaterial": "wood"
    },
    {
      "id": "bedroom",
      "name": "Bedroom",
      "polygon": [
        [
          4.8,
          0
        ],
        [
          8,
          0
        ],
        [
          8,
          4.2
        ],
        [
          4.8,
          4.2
        ]
      ],
      "floorMaterial": "wood"
    },
    {
      "id": "bathroom",
      "name": "Bathroom",
      "polygon": [
        [
          0,
          4.2
        ],
        [
          2.6,
          4.2
        ],
        [
          2.6,
          6.9
        ],
        [
          0,
          6.9
        ]
      ],
      "floorMaterial": "tile"
    },
    {
      "id": "hall",
      "name": "Entrance hall",
      "polygon": [
        [
          2.6,
          4.2
        ],
        [
          8,
          4.2
        ],
        [
          8,
          6.9
        ],
        [
          2.6,
          6.9
        ]
      ],
      "floorMaterial": "wood"
    }
  ],
  "walls": [
    {
      "id": "w-north",
      "from": [
        0,
        0
      ],
      "to": [
        8,
        0
      ],
      "thickness": 0.25,
      "exterior": true,
      "openings": [
        {
          "id": "win-living",
          "type": "window",
          "offset": 1.0,
          "width": 1.6,
          "height": 1.5,
          "sill": 0.9
        },
        {
          "id": "win-bedroom",
          "type": "window",
          "offset": 5.4,
          "width": 1.4,
          "height": 1.5,
          "sill": 0.9
        }
      ]
    },
    {
      "id": "w-east",
      "from": [
        8,
        0
      ],
      "to": [
        8,
        6.9
      ],
      "thickness": 0.25,
      "exterior": true,
      "openings": [
        {
          "id": "win-bedroom-east",
          "type": "window",
          "offset": 1.2,
          "width": 1.2,
          "height": 1.5,
          "sill": 0.9
        }
      ]
    },
    {
      "id": "w-south",
      "from": [
        0,
        6.9
      ],
      "to": [
        8,
        6.9
      ],
      "thickness": 0.25,
      "exterior": true,
      "openings": [
        {
          "id": "d-entrance",
          "type": "door",
          "offset": 5.0,
          "width": 0.9,
          "height": 2.1,
          "connects": [
            "outside",
            "hall"
          ],
          "entrance": true
        }
      ]
    },
    {
      "id": "w-west",
      "from": [
        0,
        0
      ],
      "to": [
        0,
        6.9
      ],
      "thickness": 0.25,
      "exterior": true,
      "openings": [
        {
          "id": "win-bathroom",
          "type": "window",
          "offset": 5.2,
          "width": 0.6,
          "height": 0.8,
          "sill": 1.4
        }
      ]
    },
    {
      "id": "w-living-bath",
      "from": [
        0,
        4.2
      ],
      "to": [
        2.6,
        4.2
      ],
      "thickness": 0.12,
      "exterior": false,
      "openings": []
    },
    {
      "id": "w-living-hall",
      "from": [
        2.6,
        4.2
      ],
      "to": [
        4.8,
        4.2
      ],
      "thickness": 0.12,
      "exterior": false,
      "openings": [
        {
          "id": "d-living",
          "type": "door",
          "offset": 0.6,
          "width": 0.9,
          "height": 2.1,
          "connects": [
            "hall",
            "living"
          ]
        }
      ]
    },
    {
      "id": "w-bedroom-hall",
      "from": [
        4.8,
        4.2
      ],
      "to": [
        8,
        4.2
      ],
      "thickness": 0.12,
      "exterior": false,
      "openings": [
        {
          "id": "d-bedroom",
          "type": "door",
          "offset": 0.6,
          "width": 0.9,
          "height": 2.1,
          "connects": [
            "hall",
            "bedroom"
          ]
        }
      ]
    },
    {
      "id": "w-living-bedroom",
      "from": [
        4.8,
        0
      ],
      "to": [
        4.8,
        4.2
      ],
      "thickness": 0.12,
      "exterior": false,
      "openings": []
    },
    {
      "id": "w-bath-hall",
      "from": [
        2.6,
        4.2
      ],
      "to": [
        2.6,
        6.9
      ],
      "thickness": 0.12,
      "exterior": false,
      "openings": [
        {
          "id": "d-bathroom",
          "type": "door",
          "offset": 0.6,
          "width": 0.8,
          "height": 2.1,
          "connects": [
            "hall",
            "bathroom"
          ]
        }
      ]
    }
  ],
  "viewpoints": [
    {
      "id": "V1",
      "room": "living",
      "position": [
        2.4,
        2.6
      ],
      "yawDeg": 0,
      "eyeHeight": 1.2
    },
    {
      "id": "V2",
      "room": "bedroom",
      "position": [
        6.4,
        2.4
      ],
      "yawDeg": 0,
      "eyeHeight": 1.2
    }
  ],
  "fixtures": [
    {
      "id": "washer",
      "name": "Washing machine",
      "room": "bathroom",
      "category": "appliances",
      "position": [
        0.4,
        0.85,
        4.5
      ]
    }
  ]
}
